{
  "$id": "https://bigbirdreturns.github.io/undercast/schema/clifford-number-hr-disciplinary-case.schema.json",
  "$schema": "https://json-schema.org/draft/2020-12/schema",
  "additionalProperties": false,
  "properties": {
    "as_of": {
      "const": "2026-08-01"
    },
    "authority": {
      "additionalProperties": false,
      "properties": {
        "canonical_product_effects_allowed": {
          "const": false
        },
        "control_adoption_allowed": {
          "const": false
        },
        "employer_liability_findings_allowed": {
          "const": false
        },
        "final_coroner_conclusion_claims_allowed": {
          "const": false
        },
        "graph_effects_allowed": {
          "const": false
        },
        "individual_culpability_findings_allowed": {
          "const": false
        },
        "legal_conclusions_allowed": {
          "const": false
        },
        "parent_wave_mutation_allowed": {
          "const": false
        },
        "private_source_publication_allowed": {
          "const": false
        },
        "publication_effects_allowed": {
          "const": false
        },
        "universal_prevalence_findings_allowed": {
          "const": false
        },
        "victim_character_inferences_allowed": {
          "const": false
        }
      },
      "required": [
        "canonical_product_effects_allowed",
        "control_adoption_allowed",
        "employer_liability_findings_allowed",
        "final_coroner_conclusion_claims_allowed",
        "graph_effects_allowed",
        "individual_culpability_findings_allowed",
        "legal_conclusions_allowed",
        "parent_wave_mutation_allowed",
        "private_source_publication_allowed",
        "publication_effects_allowed",
        "universal_prevalence_findings_allowed",
        "victim_character_inferences_allowed"
      ],
      "type": "object"
    },
    "case_id": {
      "const": "HRD-CHLOE-MOFFAT-2025"
    },
    "findings": {
      "minItems": 10,
      "type": "array"
    },
    "object_type": {
      "const": "named_hr_disciplinary_case"
    },
    "process_events": {
      "minItems": 11,
      "type": "array"
    },
    "prohibited_inferences": {
      "minItems": 7,
      "type": "array"
    },
    "public_record_state": {
      "const": "inquest_reporting_ongoing_no_final_conclusion_recovered"
    },
    "schema_version": {
      "const": 1
    },
    "subject": {
      "additionalProperties": false,
      "properties": {
        "age_at_death": {
          "const": 26
        },
        "death_date": {
          "const": "2025-05-20"
        },
        "employer": {
          "const": "HM Treasury"
        },
        "name": {
          "const": "Chloe Olivia Moffat"
        },
        "role": {
          "const": "personal assistant"
        }
      },
      "required": [
        "name",
        "age_at_death",
        "employer",
        "role",
        "death_date"
      ],
      "type": "object"
    },
    "terminal_receipt": {
      "type": "object"
    },
    "title": {
      "minLength": 1,
      "type": "string"
    },
    "wave_id": {
      "const": "CN-HRD-W01"
    }
  },
  "required": [
    "object_type",
    "schema_version",
    "wave_id",
    "case_id",
    "title",
    "as_of",
    "authority",
    "subject",
    "public_record_state",
    "process_events",
    "findings",
    "prohibited_inferences",
    "terminal_receipt"
  ],
  "title": "Clifford Number HR disciplinary named-case packet",
  "type": "object"
}
