{
  "as_of": "2026-08-01",
  "authority": {
    "canonical_product_effects_allowed": false,
    "control_adoption_allowed": false,
    "employer_liability_findings_allowed": false,
    "final_coroner_conclusion_claims_allowed": false,
    "graph_effects_allowed": false,
    "individual_culpability_findings_allowed": false,
    "legal_conclusions_allowed": false,
    "parent_wave_mutation_allowed": false,
    "private_source_publication_allowed": false,
    "publication_effects_allowed": false,
    "universal_prevalence_findings_allowed": false,
    "victim_character_inferences_allowed": false
  },
  "case_id": "HRD-CHLOE-MOFFAT-2025",
  "findings": [
    {
      "claim": "The public record supports a sequence of institutional acts and observed distress; it does not support a character judgment that Chloe Moffat was weak or unable to tolerate ordinary workplace pressure.",
      "id": "cm-f01",
      "limits": [
        "No diagnosis or private psychological inference is made."
      ],
      "source_ids": [
        "guardian-moffat-inquest-2026",
        "hse-stress-not-weakness"
      ],
      "status": "independently_supported_scoped"
    },
    {
      "claim": "The process produced formal-threat effects while retaining an informal fact-finding label, allowing the organization to withhold safeguards partly because providing them would make the meeting feel formal.",
      "id": "cm-f02",
      "limits": [
        "Formality arbitrage is an analytical term, not a quoted legal category or final inquest finding."
      ],
      "source_ids": [
        "guardian-moffat-inquest-2026",
        "acas-investigation-meetings",
        "acas-disciplinary-code"
      ],
      "status": "bounded_synthesis"
    },
    {
      "claim": "A process label is an inadequate safeguard trigger when practical indicators already include a serious allegation, senior attendance, access restriction, confidentiality limits, and a contemplated formal investigation.",
      "id": "cm-f03",
      "limits": [
        "The proposed severity trigger is not adopted policy or current law."
      ],
      "source_ids": [
        "guardian-moffat-inquest-2026",
        "acas-investigation-meetings"
      ],
      "status": "normative_control_not_adopted"
    },
    {
      "claim": "Refusing to bound a realistically unlikely dismissal outcome preserved maximum uncertainty at the point of visible distress.",
      "id": "cm-f04",
      "limits": [
        "The packet does not claim that reassurance must be absolute or that an investigation outcome can always be promised."
      ],
      "source_ids": [
        "guardian-moffat-inquest-2026"
      ],
      "status": "observed_mechanism_scoped"
    },
    {
      "claim": "Confidentiality and evidence-protection measures can become isolation mechanisms unless they expressly preserve access to a companion, union, healthcare, employee assistance, or independent welfare contact.",
      "id": "cm-f05",
      "limits": [
        "The packet does not reject proportionate confidentiality or evidence preservation."
      ],
      "source_ids": [
        "guardian-moffat-inquest-2026",
        "hse-support-standard",
        "hse-stress-not-weakness"
      ],
      "status": "bounded_synthesis"
    },
    {
      "claim": "Assigning pastoral care to a manager embedded in the adverse process creates a care-control collision and weakens the independence of the safety function.",
      "id": "cm-f06",
      "limits": [
        "Role conflict does not establish malicious intent or individual culpability."
      ],
      "source_ids": [
        "guardian-moffat-inquest-2026",
        "hse-role-standard"
      ],
      "status": "bounded_synthesis"
    },
    {
      "claim": "Current accountability channels can route a severe individual event toward fact-finding, organizational learning, or population-level enforcement without necessarily producing an individual professional accountability ruling.",
      "id": "cm-f07",
      "limits": [
        "This is a structural inference, not a prediction that no person will ever face accountability in this case."
      ],
      "source_ids": [
        "surrey-inquest-purpose",
        "hse-stress-enforcement-boundary",
        "guardian-moffat-inquest-2026"
      ],
      "status": "bounded_synthesis"
    },
    {
      "claim": "The absence of a public individual sanction cannot be converted into proof that no institutional failure occurred, just as procedural reform cannot substitute for causal custody of the original decisions.",
      "id": "cm-f08",
      "limits": [
        "The packet records no final inquest conclusion and no disciplinary record concerning any employee."
      ],
      "source_ids": [
        "guardian-moffat-inquest-2026",
        "surrey-inquest-purpose"
      ],
      "status": "bounded_synthesis"
    },
    {
      "claim": "Avoidable employee harm is a supported systems concept: disciplinary investigations can produce distress and trauma, and an intervention that treated investigations as a last resort substantially reduced their use in one organization.",
      "id": "cm-f09",
      "limits": [
        "The intervention evidence is not a case-specific counterfactual for Chloe Moffat."
      ],
      "source_ids": [
        "frontiers-last-resort-2024",
        "fph-disciplinary-harm-2026"
      ],
      "status": "independently_supported_scoped"
    },
    {
      "claim": "The case exemplifies the welfare-control split in modern HR: the organization invokes pastoral care while the controlling process optimizes accusation handling, confidentiality, access restriction, and institutional defensibility.",
      "id": "cm-f10",
      "limits": [
        "This finding connects the case to the estate genealogy; it does not claim that every HR function or employee behaves identically."
      ],
      "source_ids": [
        "guardian-moffat-inquest-2026",
        "hse-support-standard",
        "hse-role-standard"
      ],
      "status": "bounded_synthesis"
    }
  ],
  "object_type": "named_hr_disciplinary_case",
  "process_events": [
    {
      "details": "A complaint alleged that confidential information about colleagues had been shared.",
      "event": "anonymous_complaint_received",
      "id": "cm-e01",
      "limits": [
        "The complaint's truth, provenance, evidential weight, and motive are not adjudicated here."
      ],
      "source_ids": [
        "guardian-moffat-inquest-2026"
      ],
      "state": "reported_at_inquest"
    },
    {
      "details": "The employee was not told in advance what the meeting would concern and therefore could not prepare or arrange support.",
      "event": "meeting_convened_without_advance_subject_notice",
      "id": "cm-e02",
      "limits": [
        "The packet records the procedural contrast with Acas guidance; it does not decide legal breach."
      ],
      "source_ids": [
        "guardian-moffat-inquest-2026",
        "acas-investigation-meetings"
      ],
      "state": "reported_at_inquest"
    },
    {
      "details": "The meeting was treated as early fact-finding while the employee faced serious allegations, senior attendance, access restriction, confidentiality instructions, and preparation for a formal investigation.",
      "event": "formal_threat_signals_imposed_under_informal_label",
      "id": "cm-e03",
      "limits": [
        "The phrase formality arbitrage is an analytical classification introduced by this packet."
      ],
      "source_ids": [
        "guardian-moffat-inquest-2026",
        "acas-investigation-meetings",
        "acas-disciplinary-code"
      ],
      "state": "bounded_synthesis"
    },
    {
      "details": "A request to bring a friend for support was refused; testimony said an alternative attendee would have made the meeting feel more formal.",
      "event": "support_companion_requested_and_refused",
      "id": "cm-e04",
      "limits": [
        "There is no automatic statutory accompaniment right at every investigatory meeting; Acas identifies allowance as good practice."
      ],
      "source_ids": [
        "guardian-moffat-inquest-2026",
        "acas-investigation-meetings"
      ],
      "state": "reported_at_inquest"
    },
    {
      "details": "When the employee asked whether dismissal was possible, a senior manager declined to predict the outcome even though evidence reported to the inquest indicated dismissal was unlikely.",
      "event": "outcome_threat_left_unbounded",
      "id": "cm-e05",
      "limits": [
        "This does not establish what every lawful or reasonable manager would have said."
      ],
      "source_ids": [
        "guardian-moffat-inquest-2026"
      ],
      "state": "reported_at_inquest"
    },
    {
      "details": "The employee temporarily lost access to the director's email and diary and was instructed not to discuss the matter with colleagues.",
      "event": "isolation_and_access_restriction",
      "id": "cm-e06",
      "limits": [
        "Interim restrictions can serve legitimate evidence-protection aims; proportionality and support carve-outs remain open."
      ],
      "source_ids": [
        "guardian-moffat-inquest-2026"
      ],
      "state": "reported_at_inquest"
    },
    {
      "details": "Witness evidence described shock, crying, and acute fear about job loss and reputational consequences.",
      "event": "visible_distress_observed",
      "id": "cm-e07",
      "limits": [
        "The packet does not diagnose a medical condition or infer private mental-health history."
      ],
      "source_ids": [
        "guardian-moffat-inquest-2026"
      ],
      "state": "reported_at_inquest"
    },
    {
      "details": "The line manager was expected to provide pastoral care while also occupying a direct oversight role in the process.",
      "event": "pastoral_care_assigned_to_control_role",
      "id": "cm-e08",
      "limits": [